{
  "cross_section_controls": {
    "central_proposition_sections": [
      "SEC-01",
      "SEC-04",
      "SEC-05",
      "SEC-08",
      "SEC-09",
      "SEC-14"
    ],
    "conclusion_closure": "SEC-14必须逐一回答RQ-1至RQ-3，并同时回扣CP-1、OBJ-1至OBJ-4和INNO-H1至INNO-H3；缺少任一绑定均退回结论章。",
    "duplication_control": "背景只提出矛盾，相关工作只做比较，概念章只定义模型，研究内容展开任务，技术路线展开流程，创新章做相对差异，结论只闭环不新增论点。",
    "foundation_evidence_boundary": "SEC-11只能依据SRC-UA与SRC-TRACE来源说明能力和工程记录，并明确未核验材料；不得升级为正式论文、验收或实测成果。",
    "innovation_baseline_binding": "SEC-09中的每项创新假设必须同时引用对应PRIOR节点、至少两个公开来源、拟新增机制、比较维度、验证试验和反证条件。",
    "metric_claim_boundary": "所有MET阈值均保持暂定目标，正文只能陈述测量协议、基线、统计方法和重新标定条件，不得写成已经达到。",
    "rq_coverage": {
      "RQ-1": [
        "SEC-01",
        "SEC-02",
        "SEC-03",
        "SEC-04",
        "SEC-05",
        "SEC-06",
        "SEC-07",
        "SEC-08",
        "SEC-09",
        "SEC-10",
        "SEC-11",
        "SEC-12",
        "SEC-14"
      ],
      "RQ-2": [
        "SEC-01",
        "SEC-02",
        "SEC-03",
        "SEC-04",
        "SEC-05",
        "SEC-06",
        "SEC-07",
        "SEC-08",
        "SEC-09",
        "SEC-10",
        "SEC-11",
        "SEC-12",
        "SEC-13",
        "SEC-14"
      ],
      "RQ-3": [
        "SEC-01",
        "SEC-02",
        "SEC-03",
        "SEC-04",
        "SEC-05",
        "SEC-06",
        "SEC-07",
        "SEC-08",
        "SEC-09",
        "SEC-10",
        "SEC-11",
        "SEC-12",
        "SEC-13",
        "SEC-14"
      ]
    }
  },
  "document_contract": {
    "body_page_limit": 20,
    "max_body_pages": 20.0,
    "official_template_status": "NOT_PROVIDED",
    "plan_status": "PROVISIONAL_REVALIDATION_REQUIRED",
    "planned_body_pages": 16.9,
    "references_outside_body_limit": true,
    "target_body_pages": 16.9
  },
  "draft_batches": [
    {
      "batch_id": "STAGE-6A",
      "completion_gate": "五章均通过单章确定性检查、独立内容审查和跨章概念一致性检查。",
      "dependencies": [
        "STAGE_5_CONFIRMED"
      ],
      "purpose": "先形成问题、相关工作、概念框架和研究问题索引，为技术正文提供稳定语义与引用基线。",
      "section_ids": [
        "SEC-01",
        "SEC-02",
        "SEC-03",
        "SEC-04",
        "SEC-05"
      ],
      "total_target_pages": 5.4
    },
    {
      "batch_id": "STAGE-6B",
      "completion_gate": "研究内容、关键问题和技术路线必须逐项绑定RQ、方法、图表和反证条件，且无功能清单化。",
      "dependencies": [
        "STAGE-6A_ACCEPTED"
      ],
      "purpose": "生成研究内容、关键问题和技术路线，是申请书的核心方法批次。",
      "section_ids": [
        "SEC-06",
        "SEC-07",
        "SEC-08"
      ],
      "total_target_pages": 6.4
    },
    {
      "batch_id": "STAGE-6C",
      "completion_gate": "创新同时绑定最近工作与新机制，指标不被写成结果，研究基础不越过证据范围。",
      "dependencies": [
        "STAGE-6A_ACCEPTED",
        "STAGE-6B_ACCEPTED"
      ],
      "purpose": "生成创新、评价和研究基础，重点控制比较基线、指标状态和证据等级。",
      "section_ids": [
        "SEC-09",
        "SEC-10",
        "SEC-11"
      ],
      "total_target_pages": 3.3
    },
    {
      "batch_id": "STAGE-6D",
      "completion_gate": "结论逐一回答三项研究问题并回扣中心命题和创新假设，计划与风险不补造正式信息。",
      "dependencies": [
        "STAGE-6A_ACCEPTED",
        "STAGE-6B_ACCEPTED",
        "STAGE-6C_ACCEPTED"
      ],
      "purpose": "生成计划、风险和结论，并完成研究问题、创新和中心命题的全文闭环。",
      "section_ids": [
        "SEC-12",
        "SEC-13",
        "SEC-14"
      ],
      "total_target_pages": 1.8
    }
  ],
  "open_items_inherited": [
    "OPEN-001",
    "OPEN-002",
    "OPEN-003",
    "OPEN-004",
    "OPEN-005",
    "OPEN-006",
    "OPEN-007",
    "OPEN-008",
    "OPEN-009",
    "OPEN-010",
    "OPEN-011",
    "OPEN-012"
  ],
  "planning_mode": "REVERSIBLE_CONTENT_PLAN",
  "project_title": "人机协同决策优势冲刺关键技术研究",
  "readiness": {
    "next_stage": "STAGE_6A_PROVISIONAL_DRAFTING",
    "rationale": "论证结构、最近工作、证据边界和页数预算已足以开展可逆正文写作；正式指南、模板、团队证明、场景基线、周期和经费到位后必须重放章节合同与格式检查，当前不得视为最终提交版本。",
    "ready_for_final_submission": false,
    "ready_for_provisional_drafting": true
  },
  "revalidation_triggers": [
    "OFFICIAL_GUIDE_RECEIVED",
    "OFFICIAL_TEMPLATE_RECEIVED",
    "TEAM_EVIDENCE_RECEIVED",
    "SCENARIO_BASELINE_RECEIVED",
    "PROJECT_PERIOD_OR_BUDGET_RECEIVED"
  ],
  "schema_version": "1.0",
  "sections": [
    {
      "contract_status": "PROVISIONAL_REVALIDATION_REQUIRED",
      "expected_words": {
        "max": 550,
        "min": 350
      },
      "max_pages": 0.8,
      "must_answer": [
        "项目解决什么问题、为什么需要人机协同优势冲刺、怎样证明其有效。"
      ],
      "must_include": [
        "中心命题的适用边界",
        "三项研究问题及四项目标",
        "正文结构和验证载体概览"
      ],
      "must_not_claim": [
        "不得把暂定指标写成已达到结果",
        "不得宣称已获得正式资助或已完成验收",
        "不得给出正式指南未提供的资格与格式结论"
      ],
      "order": 1,
      "purpose": "用最短篇幅交代研究对象、核心矛盾、中心命题、三项研究问题、总体方法和预期验证价值，为全文建立统一阅读入口。",
      "required_metric_ids": [],
      "required_node_ids": [
        "CP-1",
        "RQ-1",
        "RQ-2",
        "RQ-3",
        "OBJ-1",
        "OBJ-2",
        "OBJ-3",
        "OBJ-4"
      ],
      "required_rq_ids": [
        "RQ-1",
        "RQ-2",
        "RQ-3"
      ],
      "required_source_ids": [],
      "section_id": "SEC-01",
      "section_name": "摘要与项目概览",
      "subsections": [
        {
          "paragraph_roles": [
            "提出问题与中心命题",
            "概括研究问题和方法体系"
          ],
          "subsection_id": "SEC-01-01",
          "title": "项目概览"
        },
        {
          "paragraph_roles": [
            "概括知识贡献",
            "说明验证场景与证据类型"
          ],
          "subsection_id": "SEC-01-02",
          "title": "预期贡献与验证"
        }
      ],
      "target_pages": 0.6,
      "visual_ids": []
    },
    {
      "contract_status": "PROVISIONAL_REVALIDATION_REQUIRED",
      "expected_words": {
        "max": 1100,
        "min": 800
      },
      "max_pages": 1.5,
      "must_answer": [
        "现有决策流程为何难以同时满足速度、质量、稳健性和可追溯性。",
        "本项目的科学问题与一般智能体应用有何区别。"
      ],
      "must_include": [
        "三个核心矛盾及其因果关系",
        "四类通用验证场景",
        "研究边界与非目标"
      ],
      "must_not_claim": [
        "不得把设计假设描述成行业共识",
        "不得泛化到任意开放世界决策",
        "不得引用未提供的官方背景材料"
      ],
      "order": 2,
      "purpose": "从动态复杂决策的状态分散、时间受限和责任边界三个矛盾出发，说明研究必要性，并将一般意义落到可检验的研究问题。",
      "required_metric_ids": [],
      "required_node_ids": [
        "CP-1",
        "GAP-1",
        "GAP-2",
        "GAP-3",
        "BOUND-1",
        "BOUND-2",
        "BOUND-3",
        "BOUND-4",
        "BOUND-5"
      ],
      "required_rq_ids": [
        "RQ-1",
        "RQ-2",
        "RQ-3"
      ],
      "required_source_ids": [
        "SRC-PUB-03",
        "SRC-PUB-07",
        "SRC-PUB-12",
        "SRC-STD-01"
      ],
      "section_id": "SEC-02",
      "section_name": "研究背景与意义",
      "subsections": [
        {
          "paragraph_roles": [
            "描述动态决策压力",
            "分析人工与自动化各自局限"
          ],
          "subsection_id": "SEC-02-01",
          "title": "现实需求与核心矛盾"
        },
        {
          "paragraph_roles": [
            "从三个差距提出研究价值",
            "说明跨场景可迁移价值"
          ],
          "subsection_id": "SEC-02-02",
          "title": "科学与工程意义"
        },
        {
          "paragraph_roles": [
            "列出成立条件",
            "排除非研究目标"
          ],
          "subsection_id": "SEC-02-03",
          "title": "适用边界"
        }
      ],
      "target_pages": 1.3,
      "visual_ids": []
    },
    {
      "contract_status": "PROVISIONAL_REVALIDATION_REQUIRED",
      "expected_words": {
        "max": 1350,
        "min": 1000
      },
      "max_pages": 1.8,
      "must_answer": [
        "三个研究问题各自最接近哪些已有机制。",
        "已有工作尚未覆盖哪些组合机制和验证边界。"
      ],
      "must_include": [
        "按RQ组织的研究谱系",
        "最近工作机制而非仅列论文",
        "明确的比较维度和创新边界"
      ],
      "must_not_claim": [
        "不得宣称绝对首创",
        "不得把非同行评审材料当成最近工作",
        "不得超出来源实际研究范围"
      ],
      "order": 3,
      "purpose": "用可定位公开研究建立三条最近工作链，比较已有机制、适用范围和不足，为创新假设提供克制且可核验的基线。",
      "required_metric_ids": [],
      "required_node_ids": [
        "GAP-1",
        "GAP-2",
        "GAP-3",
        "PRIOR-1",
        "PRIOR-2",
        "PRIOR-3"
      ],
      "required_rq_ids": [
        "RQ-1",
        "RQ-2",
        "RQ-3"
      ],
      "required_source_ids": [
        "SRC-PUB-01",
        "SRC-PUB-02",
        "SRC-PUB-03",
        "SRC-PUB-04",
        "SRC-PUB-05",
        "SRC-PUB-06",
        "SRC-PUB-07",
        "SRC-PUB-08",
        "SRC-PUB-09",
        "SRC-PUB-10",
        "SRC-PUB-11",
        "SRC-PUB-12",
        "SRC-PUB-13",
        "SRC-STD-01"
      ],
      "section_id": "SEC-03",
      "section_name": "相关工作与现有差距",
      "subsections": [
        {
          "paragraph_roles": [
            "归纳角色化协作与共享心智模型",
            "比较版本依赖和增量传播缺口"
          ],
          "subsection_id": "SEC-03-01",
          "title": "共享状态与多智能体协作"
        },
        {
          "paragraph_roles": [
            "归纳辩论、共识和实时决策研究",
            "比较动态预算与停止规则缺口"
          ],
          "subsection_id": "SEC-03-02",
          "title": "有限时间协作与资源调度"
        },
        {
          "paragraph_roles": [
            "归纳互补、转交、解释和风险治理",
            "比较多阶段交接与证据归因缺口"
          ],
          "subsection_id": "SEC-03-03",
          "title": "人机互补与责任治理"
        },
        {
          "paragraph_roles": [
            "形成三条差距—研究问题映射",
            "限定创新假设表述"
          ],
          "subsection_id": "SEC-03-04",
          "title": "现有差距小结"
        }
      ],
      "target_pages": 1.6,
      "visual_ids": [
        "TAB-01"
      ]
    },
    {
      "contract_status": "PROVISIONAL_REVALIDATION_REQUIRED",
      "expected_words": {
        "max": 950,
        "min": 700
      },
      "max_pages": 1.3,
      "must_answer": [
        "优势冲刺的操作性定义是什么。",
        "三个形式化模型怎样连接为统一理论框架。"
      ],
      "must_include": [
        "对象、状态、动作、预算、权限和证据的形式化元素",
        "继续、停止、降级和回滚的条件",
        "中心命题的边界条件"
      ],
      "must_not_claim": [
        "不得把概念图等同于已验证理论",
        "不得省略人类最终控制权",
        "不得引入未在上游冻结的新核心机制"
      ],
      "order": 4,
      "purpose": "形式化定义优势冲刺及其共享状态、有限窗口调度、人机权限交接三个模型，解释方法机制如何共同支撑中心命题。",
      "required_metric_ids": [],
      "required_node_ids": [
        "CP-1",
        "FM-1",